ffff9e0b5544c0c0 3530441963 C Ii:3:002:1 0:8 8 = 00000000 00000000
ffff9e0b5544c0c0 3530441992 S Ii:3:002:1 -115:8 8 <
ffff9e0b5544c0c0 3531609806 C Ii:3:002:1 0:8 8 = 01000000 00000000
ffff9e0b5544c0c0 3531609833 S Ii:3:002:1 -115:8 8 <
ffff9e0b5544c0c0 3531721791 C Ii:3:002:1 0:8 8 = 01000600 00000000
ffff9e0b5544c0c0 3531721824 S Ii:3:002:1 -115:8 8 <
ffff9e0b5544c0c0 3531785791 C Ii:3:002:1 0:8 8 = 00000600 00000000
ffff9e0b5544c0c0 3531785808 S Ii:3:002:1 -115:8 8 <
ffff9e0b5544c0c0 3531881793 C Ii:3:002:1 0:8 8 = 00000000 00000000
ffff9e0b5544c0c0 3531881838 S Ii:3:002:1 -115:8 8 <
ffff9e0b5544c0c0 3533841545 C Ii:3:002:1 0:8 8 = 00001300 00000000
ffff9e0b5544c0c0 3533841581 S Ii:3:002:1 -115:8 8 <
ffff9e0b5544c0c0 3533889514 C Ii:3:002:1 0:8 8 = 00001316 00000000
ffff9e0b5544c0c0 3533889545 S Ii:3:002:1 -115:8 8 <
ffff9e0b5544c0c0 3533913518 C Ii:3:002:1 0:8 8 = 00000016 00000000
ffff9e0b5544c0c0 3533913553 S Ii:3:002:1 -115:8 8 <
ffff9e0b5544c0c0 3534025495 C Ii:3:002:1 0:8 8 = 00002c16 00000000
ffff9e0b5544c0c0 3534025532 S Ii:3:002:1 -115:8 8 <
ffff9e0b5544c0c0 3534121482 C Ii:3:002:1 0:8 8 = 00002c16 04000000
ffff9e0b5544c0c0 3534121516 S Ii:3:002:1 -115:8 8 <
ffff9e0b5544c0c0 3534145472 C Ii:3:002:1 0:8 8 = 00002c00 04000000
ffff9e0b5544c0c0 3534145487 S Ii:3:002:1 -115:8 8 <
ffff9e0b5544c0c0 3534169469 C Ii:3:002:1 0:8 8 = 00000000 04000000
ffff9e0b5544c0c0 3534169484 S Ii:3:002:1 -115:8 8 <
ffff9e0b5544c0c0 3534257478 C Ii:3:002:1 0:8 8 = 00001800 04000000
ffff9e0b5544c0c0 3534257526 S Ii:3:002:1 -115:8 8 <
ffff9e0b5544c0c0 3534266019 C Ii:3:002:1 0:8 8 = 00001800 00000000
ffff9e0b5544c0c0 3534266066 S Ii:3:002:1 -115:8 8 <
ffff9e0b5544c0c0 3534385447 C Ii:3:002:1 0:8 8 = 0000181b 00000000
ffff9e0b5544c0c0 3534385480 S Ii:3:002:1 -115:8 8 <
ffff9e0b5544c0c0 3534449446 C Ii:3:002:1 0:8 8 = 0000001b 00000000
ffff9e0b5544c0c0 3534449481 S Ii:3:002:1 -115:8 8 <
ffff9e0b5544c0c0 3534457446 C Ii:3:002:1 0:8 8 = 00002c1b 00000000
ffff9e0b5544c0c0 3534457486 S Ii:3:002:1 -115:8 8 <
ffff9e0b5544c0c0 3534553423 C Ii:3:002:1 0:8 8 = 00002c00 00000000
ffff9e0b5544c0c0 3534553457 S Ii:3:002:1 -115:8 8 <
ffff9e0b5544c0c0 3534569427 C Ii:3:002:1 0:8 8 = 02002c00 00000000
ffff9e0b5544c0c0 3534569441 S Ii:3:002:1 -115:8 8 <
ffff9e0b5544c0c0 3534697421 C Ii:3:002:1 0:8 8 = 02000000 00000000
ffff9e0b5544c0c0 3534697464 S Ii:3:002:1 -115:8 8 <
ffff9e0b5544c0c0 3534745398 C Ii:3:002:1 0:8 8 = 02002c31 00000000
ffff9e0b5544c0c0 3534745434 S Ii:3:002:1 -115:8 8 <
ffff9e0b5544c0c0 3534769390 C Ii:3:002:1 0:8 8 = 00002c31 00000000
ffff9e0b5544c0c0 3534769405 S Ii:3:002:1 -115:8 8 <
ffff9e0b5544c0c0 3534785402 C Ii:3:002:1 0:8 8 = 00000031 00000000
ffff9e0b5544c0c0 3534785417 S Ii:3:002:1 -115:8 8 <
ffff9e0b5544c0c0 3534825389 C Ii:3:002:1 0:8 8 = 00000000 00000000
ffff9e0b5544c0c0 3534825423 S Ii:3:002:1 -115:8 8 <
ffff9e0b5544c0c0 3535169347 C Ii:3:002:1 0:8 8 = 00002c00 00000000
ffff9e0b5544c0c0 3535169380 S Ii:3:002:1 -115:8 8 <
ffff9e0b5544c0c0 3535281345 C Ii:3:002:1 0:8 8 = 00000000 00000000
ffff9e0b5544c0c0 3535281388 S Ii:3:002:1 -115:8 8 <
ffff9e0b5544c0c0 3535657291 C Ii:3:002:1 0:8 8 = 00000a00 00000000
ffff9e0b5544c0c0 3535657340 S Ii:3:002:1 -115:8 8 <
ffff9e0b5544c0c0 3535761257 C Ii:3:002:1 0:8 8 = 00000000 00000000
ffff9e0b5544c0c0 3535761288 S Ii:3:002:1 -115:8 8 <
ffff9e0b5544c0c0 3535881266 C Ii:3:002:1 0:8 8 = 00001500 00000000
ffff9e0b5544c0c0 3535881311 S Ii:3:002:1 -115:8 8 <
ffff9e0b5544c0c0 3535977235 C Ii:3:002:1 0:8 8 = 00001508 00000000
ffff9e0b5544c0c0 3535977284 S Ii:3:002:1 -115:8 8 <
ffff9e0b5544c0c0 3536017246 C Ii:3:002:1 0:8 8 = 00000008 00000000
ffff9e0b5544c0c0 3536017280 S Ii:3:002:1 -115:8 8 <
ffff9e0b5544c0c0 3536049229 C Ii:3:002:1 0:8 8 = 00001308 00000000
ffff9e0b5544c0c0 3536049268 S Ii:3:002:1 -115:8 8 <
ffff9e0b5544c0c0 3536161230 C Ii:3:002:1 0:8 8 = 00001300 00000000
ffff9e0b5544c0c0 3536161285 S Ii:3:002:1 -115:8 8 <
ffff9e0b5544c0c0 3536193213 C Ii:3:002:1 0:8 8 = 00000000 00000000
ffff9e0b5544c0c0 3536193250 S Ii:3:002:1 -115:8 8 <
ffff9e0b5544c0c0 3536225220 C Ii:3:002:1 0:8 8 = 00002c00 00000000
ffff9e0b5544c0c0 3536225265 S Ii:3:002:1 -115:8 8 <
ffff9e0b5544c0c0 3536321208 C Ii:3:002:1 0:8 8 = 00002c06 00000000
ffff9e0b5544c0c0 3536321253 S Ii:3:002:1 -115:8 8 <
ffff9e0b5544c0c0 3536369188 C Ii:3:002:1 0:8 8 = 00000006 00000000
ffff9e0b5544c0c0 3536369224 S Ii:3:002:1 -115:8 8 <
ffff9e0b5544c0c0 3536417825 C Ii:3:002:1 0:8 8 = 00000406 00000000
ffff9e0b5544c0c0 3536417874 S Ii:3:002:1 -115:8 8 <
ffff9e0b5544c0c0 3536449177 C Ii:3:002:1 0:8 8 = 00000400 00000000
ffff9e0b5544c0c0 3536449216 S Ii:3:002:1 -115:8 8 <
ffff9e0b5544c0c0 3536577170 C Ii:3:002:1 0:8 8 = 00000417 00000000
ffff9e0b5544c0c0 3536577210 S Ii:3:002:1 -115:8 8 <
ffff9e0b5544c0c0 3536617157 C Ii:3:002:1 0:8 8 = 00000017 00000000
ffff9e0b5544c0c0 3536617195 S Ii:3:002:1 -115:8 8 <
ffff9e0b5544c0c0 3536649142 C Ii:3:002:1 0:8 8 = 00002817 00000000
ffff9e0b5544c0c0 3536649180 S Ii:3:002:1 -115:8 8 <
ffff9e0b5544c0c0 3536745147 C Ii:3:002:1 0:8 8 = 00002800 00000000
ffff9e0b5544c0c0 3536745189 S Ii:3:002:1 -115:8 8 <
ffff9e0b5544c0c0 3536833135 C Ii:3:002:1 0:8 8 = 00000000 00000000
ffff9e0b5544c0c0 3536833174 S Ii:3:002:1 -115:8 8 <
ffff9e0b5544c0c0 3538944977 C Ii:3:002:1 0:8 8 = 00003500 00000000
ffff9e0b5544c0c0 3538945024 S Ii:3:002:1 -115:8 8 <
ffff9e0b5544c0c0 3539008849 C Ii:3:002:1 0:8 8 = 00000000 00000000
ffff9e0b5544c0c0 3539008881 S Ii:3:002:1 -115:8 8 <
ffff9e0b5544c0c0 3539105522 C Ii:3:002:1 0:8 8 = 00003500 00000000
ffff9e0b5544c0c0 3539105568 S Ii:3:002:1 -115:8 8 <
ffff9e0b5544c0c0 3539240805 C Ii:3:002:1 0:8 8 = 00000000 00000000
ffff9e0b5544c0c0 3539240844 S Ii:3:002:1 -115:8 8 <
ffff9e0b5544c0c0 3540224680 C Ii:3:002:1 0:8 8 = 00003500 00000000
ffff9e0b5544c0c0 3540224718 S Ii:3:002:1 -115:8 8 <
ffff9e0b5544c0c0 3540376683 C Ii:3:002:1 0:8 8 = 00000000 00000000
ffff9e0b5544c0c0 3540376727 S Ii:3:002:1 -115:8 8 <
ffff9e0b5544c0c0 3540392668 C Ii:3:002:1 0:8 8 = 00001f00 00000000
ffff9e0b5544c0c0 3540392705 S Ii:3:002:1 -115:8 8 <
ffff9e0b5544c0c0 3540488655 C Ii:3:002:1 0:8 8 = 00000000 00000000
ffff9e0b5544c0c0 3540488698 S Ii:3:002:1 -115:8 8 <
ffff9e0b5544c0c0 3540632761 C Ii:3:002:1 0:8 8 = 00003500 00000000
ffff9e0b5544c0c0 3540632808 S Ii:3:002:1 -115:8 8 <
ffff9e0b5544c0c0 3540728624 C Ii:3:002:1 0:8 8 = 0000351e 00000000
ffff9e0b5544c0c0 3540728661 S Ii:3:002:1 -115:8 8 <
ffff9e0b5544c0c0 3540800641 C Ii:3:002:1 0:8 8 = 0000001e 00000000
ffff9e0b5544c0c0 3540800682 S Ii:3:002:1 -115:8 8 <
ffff9e0b5544c0c0 3540904619 C Ii:3:002:1 0:8 8 = 00000000 00000000
ffff9e0b5544c0c0 3540904668 S Ii:3:002:1 -115:8 8 <
ffff9e0b5544c0c0 3541768487 C Ii:3:002:1 0:8 8 = 00000a00 00000000
ffff9e0b5544c0c0 3541768534 S Ii:3:002:1 -115:8 8 <
ffff9e0b5544c0c0 3541864468 C Ii:3:002:1 0:8 8 = 00000a0c 00000000
ffff9e0b5544c0c0 3541864500 S Ii:3:002:1 -115:8 8 <
ffff9e0b5544c0c0 3541880460 C Ii:3:002:1 0:8 8 = 0000000c 00000000
ffff9e0b5544c0c0 3541880478 S Ii:3:002:1 -115:8 8 <
ffff9e0b5544c0c0 3541944469 C Ii:3:002:1 0:8 8 = 0000170c 00000000
ffff9e0b5544c0c0 3541944507 S Ii:3:002:1 -115:8 8 <
ffff9e0b5544c0c0 3541968448 C Ii:3:002:1 0:8 8 = 00001700 00000000
ffff9e0b5544c0c0 3541968461 S Ii:3:002:1 -115:8 8 <
ffff9e0b5544c0c0 3542072447 C Ii:3:002:1 0:8 8 = 00000000 00000000
ffff9e0b5544c0c0 3542072498 S Ii:3:002:1 -115:8 8 <
ffff9e0b5544c0c0 3542080465 C Ii:3:002:1 0:8 8 = 00002c00 00000000
ffff9e0b5544c0c0 3542080483 S Ii:3:002:1 -115:8 8 <
ffff9e0b5544c0c0 3542144454 C Ii:3:002:1 0:8 8 = 00000000 00000000
ffff9e0b5544c0c0 3542144491 S Ii:3:002:1 -115:8 8 <
ffff9e0b5544c0c0 3542248431 C Ii:3:002:1 0:8 8 = 00000400 00000000
ffff9e0b5544c0c0 3542248468 S Ii:3:002:1 -115:8 8 <
ffff9e0b5544c0c0 3542344432 C Ii:3:002:1 0:8 8 = 00000000 00000000
ffff9e0b5544c0c0 3542344476 S Ii:3:002:1 -115:8 8 <
ffff9e0b5544c0c0 3542440411 C Ii:3:002:1 0:8 8 = 00000400 00000000
ffff9e0b5544c0c0 3542440448 S Ii:3:002:1 -115:8 8 <
ffff9e0b5544c0c0 3542448561 C Ii:3:002:1 0:8 8 = 00000407 00000000
ffff9e0b5544c0c0 3542448578 S Ii:3:002:1 -115:8 8 <
ffff9e0b5544c0c0 3542480407 C Ii:3:002:1 0:8 8 = 00000007 00000000
ffff9e0b5544c0c0 3542480442 S Ii:3:002:1 -115:8 8 <
ffff9e0b5544c0c0 3542528416 C Ii:3:002:1 0:8 8 = 00000000 00000000
ffff9e0b5544c0c0 3542528460 S Ii:3:002:1 -115:8 8 <
ffff9e0b5544c0c0 3542992353 C Ii:3:002:1 0:8 8 = 00002a00 00000000
ffff9e0b5544c0c0 3542992403 S Ii:3:002:1 -115:8 8 <
ffff9e0b5544c0c0 3543040329 C Ii:3:002:1 0:8 8 = 00000000 00000000
ffff9e0b5544c0c0 3543040363 S Ii:3:002:1 -115:8 8 <
ffff9e0b5544c0c0 3543160315 C Ii:3:002:1 0:8 8 = 00002a00 00000000
ffff9e0b5544c0c0 3543160353 S Ii:3:002:1 -115:8 8 <
ffff9e0b5544c0c0 3543232785 C Ii:3:002:1 0:8 8 = 00000000 00000000
ffff9e0b5544c0c0 3543232831 S Ii:3:002:1 -115:8 8 <
ffff9e0b5544c0c0 3543392274 C Ii:3:002:1 0:8 8 = 00000700 00000000
ffff9e0b5544c0c0 3543392313 S Ii:3:002:1 -115:8 8 <
ffff9e0b5544c0c0 3543480370 C Ii:3:002:1 0:8 8 = 00000000 00000000
ffff9e0b5544c0c0 3543480431 S Ii:3:002:1 -115:8 8 <
ffff9e0b5544c0c0 3543560274 C Ii:3:002:1 0:8 8 = 00000700 00000000
ffff9e0b5544c0c0 3543560323 S Ii:3:002:1 -115:8 8 <
ffff9e0b5544c0c0 3543664241 C Ii:3:002:1 0:8 8 = 0000072c 00000000
ffff9e0b5544c0c0 3543664277 S Ii:3:002:1 -115:8 8 <
ffff9e0b5544c0c0 3543736264 C Ii:3:002:1 0:8 8 = 0000002c 00000000
ffff9e0b5544c0c0 3543736307 S Ii:3:002:1 -115:8 8 <
ffff9e0b5544c0c0 3543768227 C Ii:3:002:1 0:8 8 = 00000000 00000000
ffff9e0b5544c0c0 3543768261 S Ii:3:002:1 -115:8 8 <
ffff9e0b5544c0c0 3543776339 C Ii:3:002:1 0:8 8 = 00003700 00000000
ffff9e0b5544c0c0 3543776372 S Ii:3:002:1 -115:8 8 <
ffff9e0b5544c0c0 3543872232 C Ii:3:002:1 0:8 8 = 00003728 00000000
ffff9e0b5544c0c0 3543872265 S Ii:3:002:1 -115:8 8 <
